{
  "building": "우정정보관",
  "floor": "4F",
  "current_node_id": "4F-current",
  "nodes": [
    {
      "id": "4F-current",
      "type": "junction",
      "label": "현위치",
      "x": 0.355,
      "y": 0.425
    },
    {
      "id": "4F-elev-1",
      "type": "elevator_hall",
      "label": "엘리베이터",
      "x": 0.38,
      "y": 0.435
    },
    {
      "id": "4F-stairs-west",
      "type": "stairs",
      "label": "서측 계단",
      "x": 0.3,
      "y": 0.45
    },
    {
      "id": "4F-stairs-east",
      "type": "stairs",
      "label": "동측 계단",
      "x": 0.56,
      "y": 0.455
    },
    {
      "id": "4F-406",
      "type": "room",
      "label": "406호",
      "x": 0.41,
      "y": 0.42
    },
    {
      "id": "4F-405",
      "type": "room",
      "label": "405호",
      "x": 0.435,
      "y": 0.42
    },
    {
      "id": "4F-404",
      "type": "room",
      "label": "404호",
      "x": 0.465,
      "y": 0.42
    },
    {
      "id": "4F-403",
      "type": "room",
      "label": "403호",
      "x": 0.493,
      "y": 0.42
    },
    {
      "id": "4F-402",
      "type": "room",
      "label": "402호",
      "x": 0.518,
      "y": 0.42
    },
    {
      "id": "4F-407B",
      "type": "room",
      "label": "407B호",
      "x": 0.23,
      "y": 0.575
    },
    {
      "id": "4F-407A",
      "type": "room",
      "label": "407A호",
      "x": 0.3,
      "y": 0.575
    },
    {
      "id": "4F-408",
      "type": "room",
      "label": "408호",
      "x": 0.23,
      "y": 0.73
    },
    {
      "id": "4F-409",
      "type": "room",
      "label": "409호",
      "x": 0.3,
      "y": 0.73
    },
    {
      "id": "4F-410",
      "type": "room",
      "label": "410호",
      "x": 0.355,
      "y": 0.73
    },
    {
      "id": "4F-411",
      "type": "room",
      "label": "411호",
      "x": 0.39,
      "y": 0.73
    },
    {
      "id": "4F-413",
      "type": "room",
      "label": "413호(화장실)",
      "x": 0.38,
      "y": 0.54
    },
    {
      "id": "4F-412",
      "type": "room",
      "label": "412호(화장실)",
      "x": 0.38,
      "y": 0.615
    },
    {
      "id": "4F-401A",
      "type": "room",
      "label": "401A호",
      "x": 0.435,
      "y": 0.575
    },
    {
      "id": "4F-401B",
      "type": "room",
      "label": "401B호",
      "x": 0.5,
      "y": 0.575
    },
    {
      "id": "4F-401C",
      "type": "room",
      "label": "401C호",
      "x": 0.565,
      "y": 0.575
    },
    {
      "id": "4F-j-north-stairs",
      "type": "junction",
      "label": "",
      "x": 0.34,
      "y": 0.45
    },
    {
      "id": "4F-j-current",
      "type": "junction",
      "label": "",
      "x": 0.355,
      "y": 0.49
    },
    {
      "id": "4F-j-elev",
      "type": "junction",
      "label": "",
      "x": 0.38,
      "y": 0.49
    },
    {
      "id": "4F-j-406",
      "type": "junction",
      "label": "",
      "x": 0.41,
      "y": 0.49
    },
    {
      "id": "4F-j-405",
      "type": "junction",
      "label": "",
      "x": 0.435,
      "y": 0.49
    },
    {
      "id": "4F-j-404",
      "type": "junction",
      "label": "",
      "x": 0.465,
      "y": 0.49
    },
    {
      "id": "4F-j-403",
      "type": "junction",
      "label": "",
      "x": 0.493,
      "y": 0.49
    },
    {
      "id": "4F-j-402",
      "type": "junction",
      "label": "",
      "x": 0.518,
      "y": 0.49
    },
    {
      "id": "4F-j-east-stairs",
      "type": "junction",
      "label": "",
      "x": 0.54,
      "y": 0.49
    },
    {
      "id": "4F-j-cross",
      "type": "junction",
      "label": "",
      "x": 0.345,
      "y": 0.645
    },
    {
      "id": "4F-j-407a-409",
      "type": "junction",
      "label": "",
      "x": 0.3,
      "y": 0.645
    },
    {
      "id": "4F-j-407b-408",
      "type": "junction",
      "label": "",
      "x": 0.23,
      "y": 0.645
    },
    {
      "id": "4F-j-410",
      "type": "junction",
      "label": "",
      "x": 0.365,
      "y": 0.645
    },
    {
      "id": "4F-j-411",
      "type": "junction",
      "label": "",
      "x": 0.395,
      "y": 0.645
    }
  ],
  "edges": [
    {
      "from": "4F-current",
      "to": "4F-j-current",
      "type": "walk",
      "length_m": 3.7,
      "heading_deg": 180
    },
    {
      "from": "4F-j-north-stairs",
      "to": "4F-stairs-west",
      "type": "walk",
      "length_m": 4.0,
      "heading_deg": 270
    },
    {
      "from": "4F-j-north-stairs",
      "to": "4F-j-current",
      "type": "walk",
      "length_m": 2.7,
      "heading_deg": 146
    },
    {
      "from": "4F-j-current",
      "to": "4F-j-elev",
      "type": "walk",
      "length_m": 2.5,
      "heading_deg": 90
    },
    {
      "from": "4F-j-elev",
      "to": "4F-elev-1",
      "type": "walk",
      "length_m": 3.1,
      "heading_deg": 0
    },
    {
      "from": "4F-j-elev",
      "to": "4F-j-406",
      "type": "walk",
      "length_m": 3.0,
      "heading_deg": 90
    },
    {
      "from": "4F-j-406",
      "to": "4F-406",
      "type": "walk",
      "length_m": 3.9,
      "heading_deg": 0
    },
    {
      "from": "4F-j-406",
      "to": "4F-j-405",
      "type": "walk",
      "length_m": 2.5,
      "heading_deg": 90
    },
    {
      "from": "4F-j-405",
      "to": "4F-405",
      "type": "walk",
      "length_m": 3.9,
      "heading_deg": 0
    },
    {
      "from": "4F-j-405",
      "to": "4F-401A",
      "type": "walk",
      "length_m": 4.8,
      "heading_deg": 180
    },
    {
      "from": "4F-j-405",
      "to": "4F-j-404",
      "type": "walk",
      "length_m": 3.0,
      "heading_deg": 90
    },
    {
      "from": "4F-j-404",
      "to": "4F-404",
      "type": "walk",
      "length_m": 3.9,
      "heading_deg": 0
    },
    {
      "from": "4F-j-404",
      "to": "4F-j-403",
      "type": "walk",
      "length_m": 2.8,
      "heading_deg": 90
    },
    {
      "from": "4F-j-403",
      "to": "4F-403",
      "type": "walk",
      "length_m": 3.9,
      "heading_deg": 0
    },
    {
      "from": "4F-j-403",
      "to": "4F-401B",
      "type": "walk",
      "length_m": 4.8,
      "heading_deg": 172
    },
    {
      "from": "4F-j-403",
      "to": "4F-j-402",
      "type": "walk",
      "length_m": 2.5,
      "heading_deg": 90
    },
    {
      "from": "4F-j-402",
      "to": "4F-402",
      "type": "walk",
      "length_m": 3.9,
      "heading_deg": 0
    },
    {
      "from": "4F-j-402",
      "to": "4F-j-east-stairs",
      "type": "walk",
      "length_m": 2.2,
      "heading_deg": 90
    },
    {
      "from": "4F-j-east-stairs",
      "to": "4F-stairs-east",
      "type": "walk",
      "length_m": 2.8,
      "heading_deg": 45
    },
    {
      "from": "4F-j-east-stairs",
      "to": "4F-401C",
      "type": "walk",
      "length_m": 5.4,
      "heading_deg": 152
    },
    {
      "from": "4F-j-current",
      "to": "4F-j-cross",
      "type": "walk",
      "length_m": 8.8,
      "heading_deg": 187
    },
    {
      "from": "4F-j-cross",
      "to": "4F-413",
      "type": "walk",
      "length_m": 6.9,
      "heading_deg": 31
    },
    {
      "from": "4F-j-cross",
      "to": "4F-412",
      "type": "walk",
      "length_m": 3.9,
      "heading_deg": 64
    },
    {
      "from": "4F-j-cross",
      "to": "4F-j-407a-409",
      "type": "walk",
      "length_m": 4.5,
      "heading_deg": 270
    },
    {
      "from": "4F-j-407a-409",
      "to": "4F-407A",
      "type": "walk",
      "length_m": 3.9,
      "heading_deg": 0
    },
    {
      "from": "4F-j-407a-409",
      "to": "4F-409",
      "type": "walk",
      "length_m": 4.8,
      "heading_deg": 180
    },
    {
      "from": "4F-j-407a-409",
      "to": "4F-j-407b-408",
      "type": "walk",
      "length_m": 7.0,
      "heading_deg": 270
    },
    {
      "from": "4F-j-407b-408",
      "to": "4F-407B",
      "type": "walk",
      "length_m": 3.9,
      "heading_deg": 0
    },
    {
      "from": "4F-j-407b-408",
      "to": "4F-408",
      "type": "walk",
      "length_m": 4.8,
      "heading_deg": 180
    },
    {
      "from": "4F-j-cross",
      "to": "4F-j-410",
      "type": "walk",
      "length_m": 2.0,
      "heading_deg": 90
    },
    {
      "from": "4F-j-410",
      "to": "4F-410",
      "type": "walk",
      "length_m": 4.9,
      "heading_deg": 192
    },
    {
      "from": "4F-j-410",
      "to": "4F-j-411",
      "type": "walk",
      "length_m": 3.0,
      "heading_deg": 90
    },
    {
      "from": "4F-j-411",
      "to": "4F-411",
      "type": "walk",
      "length_m": 4.8,
      "heading_deg": 186
    }
  ],
  "elevators": []
}
